breed,url,a_adaptability,a1_adapts_well_to_apartment_living,a2_good_for_novice_owners,a3_sensitivity_level,a4_tolerates_being_alone,a5_tolerates_cold_weather,a6_tolerates_hot_weather,b_all_around_friendliness,b1_affectionate_with_family,b2_incredibly_kid_friendly_dogs,b3_dog_friendly,b4_friendly_toward_strangers,c_health_grooming,c1_amount_of_shedding,c2_drooling_potential,c3_easy_to_groom,c4_general_health,c5_potential_for_weight_gain,c6_size,d_trainability,d1_easy_to_train,d2_intelligence,d3_potential_for_mouthiness,d4_prey_drive,d5_tendency_to_bark_or_howl,d6_wanderlust_potential,e_exercise_needs,e1_energy_level,e2_intensity,e3_exercise_needs,e4_potential_for_playfulness,breed_group,height,weight,life_span,extracted_paragraph,extracted_image_url
Fox Terrier,https://dogtime.com/dog-breeds/fox-terrier,3,3,3,3,3,3,4,4,4,4,3,3,2,2,1,2,4,2,2,4,5,5,3,5,3,3,5,5,5,5,5,Terrier Dogs,"Up to 1 foot, 3 inches tall at the shoulder",15 to 19 pounds,10 to 15 years,"The Wire Fox Terrier is a medium-sized dog breed originally used for fox hunting in England. With their wiry and dense double coat, triangular head, dark eyes, and small V-shaped ears, this terrier exudes an alert and intelligent expression. Coupled with a well-muscled build and a spirited but cocky demeanor, Wire Fox Terriers are not only visually striking but also highly energetic and playful.",https://dogtime.com/wp-content/uploads/sites/12/2024/01/GettyImages-828399432-e1705075052179.jpg?w=1024
French Bulldog,https://dogtime.com/dog-breeds/french-bulldog,3,5,5,3,1,2,1,4,5,4,4,4,3,3,1,5,2,4,2,3,4,3,3,2,3,2,4,3,4,2,5,Companion Dogs,11 inches to 1 foot tall at the shoulder,16 to 28 pounds,11 to 14 years,"With their unique charm and dynamic personality, the French Bulldog has become a beloved breed among dog lovers everywhere. Despite their name, these pups originated in England. First bred as smaller versions of the Bulldog, they were later brought to France by English lacemakers, where they gained their “Frenchie” moniker. Over the years, these lovable pups have captured the hearts of many with their playful, adaptable, and affectionate nature.",https://dogtime.com/wp-content/uploads/sites/12/2024/01/GettyImages-821730372-e1705934561973.jpg?w=1024
French Spaniel,https://dogtime.com/dog-breeds/french-spaniel,3,2,4,4,3,4,2,4,5,4,4,4,3,3,2,3,4,2,3,3,4,4,2,3,2,2,4,5,3,4,4,Sporting Dogs,21 to 24 inches.,45 to 60 pounds.,10 to 12 years.,"The French Spaniel is a purebred dog from France and Canada. These dogs are sociable, intelligent, and gentle, making up some of any pooch’s best qualities. The French Spaniel goes by several names, including Epagneul Francais, French Setter, and Canadian Setter. Despite their status as a pure breed, you may find these dogs in shelters and rescues, so remember to adopt!",https://dogtime.com/wp-content/uploads/sites/12/2023/09/GettyImages-1186335905-e1696010191914.jpg?w=1024
Frenchton,https://dogtime.com/dog-breeds/frenchton,4,5,5,3,2,3,3,5,5,5,5,5,3,4,3,5,4,2,2,3,4,4,2,2,3,3,4,3,3,3,5,Mixed Breed Dogs,11 to 14 inches,15 to 25 pounds,12 to 15 years,"The Frenchton is a mixed breed dog — a cross between the Boston Terrier and French Bulldog breeds. Sturdy, sociable, playful, and chill, these pups inherited some of the best qualities from both of their parents.",https://dogtime.com/wp-content/uploads/sites/12/2020/01/frenchton-mixed-dog-breed-pictures-cover.jpg?w=760
Frengle,https://dogtime.com/dog-breeds/frengle,3,4,4,4,3,2,2,5,5,5,4,4,3,3,1,5,4,4,3,3,3,4,3,3,2,3,4,4,3,4,5,Mixed Breed Dogs,8 to 15 inches,18 to 30 pounds,10 to 15 years,"The Frengle is a mixed dog breed–a cross between the French Bulldog and Beagle dog breeds. Charismatic, affectionate, and even-tempered, these pups inherited some of the best qualities from both of their parents.",https://dogtime.com/wp-content/uploads/sites/12/2020/02/frengle-mixed-dog-breed-pictures-cover.jpg?w=760
German Pinscher,https://dogtime.com/dog-breeds/german-pinscher,3,3,3,4,3,3,4,3,5,3,2,2,3,3,1,5,4,3,3,4,4,5,3,5,3,4,5,5,3,5,5,Working Dogs,17 to 20 inches tall at the shoulder,25 to 45 pounds,12 to 14 years,"The German Pinscher, or the Standard Pinscher, is a medium-sized breed known for its sleek, elegant appearance, intelligence, and spirited personality. Originally from Germany, these hardworking dogs performed various roles, including hunting vermin and guarding homes and farms. They have a distinct, well-proportioned build with a short, glossy coat.",https://dogtime.com/wp-content/uploads/sites/12/2023/10/GettyImages-1241525012-1-e1696424722713.jpg?w=1024
German Shepherd Dog,https://dogtime.com/dog-breeds/german-shepherd-dog,3,3,2,5,2,4,3,4,5,5,2,4,4,5,1,5,4,2,4,4,5,5,5,4,4,2,5,5,5,5,5,Herding Dogs,"1 foot, 10 inches to 2 feet, 2 inches tall at the shoulder",75 to 95 pounds,10 to 14 years,"The German Shepherd Dog, known as the Alsatian if you’re living in the United Kingdom, is a large working breed from Germany prized for their incredible intelligence and unwavering loyalty. The German Shepherd is highly intelligent and trainable, and their unique abilities are often put to use. Because of their inherent desire to work, German Shepherds often find roles in law enforcement, including bomb detection and forensics. They also excel in search and rescue, therapy work, and as service dogs. While we tend to think of German Shepherds serving in these modern-day roles, as their name indicates, they were first used for herding.",https://dogtime.com/wp-content/uploads/sites/12/2023/11/GettyImages-529202089-e1701095552546.jpg?w=1024
German Shepherd Pit Bull,https://dogtime.com/dog-breeds/german-shepherd-pit-bull,2,1,1,4,1,3,3,5,5,5,4,4,4,5,1,5,4,4,4,4,5,5,5,4,4,3,5,5,5,5,5,Mixed Breed Dogs,17 to 26 inches ,30 to 90 pounds ,10 to 12 years ,"The German Shepherd Pit Bull mix, often referred to as a “Shepherd Pit” or “Shep-Pit,” is a unique and dynamic crossbreed that combines the characteristics of two distinct and powerful dog breeds. The German Shepherd is renowned for its intelligence, loyalty, and versatility. They often stand out as police, search and rescue, and service dogs. On the other hand, the American Pit Bull Terrier is known for its strength, agility, and affectionate nature. When these two breeds are combined, the result is a hybrid that inherits a blend of both physical and temperamental traits.",https://dogtime.com/wp-content/uploads/sites/12/2020/02/german-shepherd-pit-bull-mixed-dog-breed-pictures-COVER.jpg?w=760
German Sheprador,https://dogtime.com/dog-breeds/german-sheprador,3,2,1,5,2,4,4,5,5,5,4,4,4,5,2,5,3,3,4,4,5,5,5,3,2,2,5,5,5,5,5,Mixed Breed Dogs,20 to 27 inches ,60 to 95 pounds ,10 to 12 years ,"The German Sheprador is a mixed breed dog — a cross between the German Shepherd and Labrador Retriever breeds. Large, energetic, and loyal, these pups inherited some of the best qualities from both of their parents.",https://dogtime.com/wp-content/uploads/sites/12/2019/09/german-sheprador-mixed-dog-breed-pictures-cover.jpg?w=760
German Shorthaired Pointer,https://dogtime.com/dog-breeds/german-shorthaired-pointer,2,1,2,4,1,2,4,4,5,5,4,3,3,2,2,5,3,3,3,5,5,5,4,5,3,5,5,5,3,5,5,Sporting Dogs,"1 foot, 9 inches to 2 feet, 1 inch tall at the shoulder",45 to 70 pounds,12 to 15 years,"The German Shorthaired Pointer, often referred to as the GSP dog, is a versatile and energetic breed known for their athleticism and intelligence. Originating in Germany, the GSP dog was developed in the 19th century with the intention of creating a multipurpose hunting dog capable of working on both land and water. This beloved breed is medium to large-sized with an athletic build. They have a sleek coat that comes in various colors and patterns. The coat is low maintenance and provides protection against different weather conditions. The German Shorthaired Pointer temperament is characterized by a friendly and outgoing nature, loyalty, affection, and an energetic but gentle disposition.",https://dogtime.com/wp-content/uploads/sites/12/2023/07/GettyImages-1287712832-e1692459746136.jpg?w=1024
German Spitz,https://dogtime.com/dog-breeds/german-spitz,3,4,2,3,3,3,2,4,5,4,3,3,3,4,1,2,4,4,1,4,2,4,4,5,4,2,4,5,3,4,4,Companion Dogs,12 to 15 inches,21 to 29 pounds,13 to 15 years,"The German Spitz is one of the oldest dog breeds originating from Europe. Attentive, energetic, and devoted, these pups have some of the best qualities among any dog breed around. German Spitzes go by several other names such as Spitz, German Spitz Mittelspitz, and Deutscher Spitz. If you’d like to bring home a German Spitz puppy, be sure to do your research on requirements for care and training.",https://dogtime.com/wp-content/uploads/sites/12/2023/09/GettyImages-1145716084-e1695412569891.jpg?w=1024
German Wirehaired Pointer,https://dogtime.com/dog-breeds/german-wirehaired-pointer,3,2,3,4,2,3,4,3,5,3,3,2,3,2,2,4,4,3,4,4,4,5,4,4,3,5,5,5,4,5,5,Sporting Dogs,"1 foot, 10 inches to 2 feet, 2 inches tall at the shoulder",60 to 70 pounds,12 to 14 years,"The German Wirehaired Pointer, also referred to as the GWP or the Deutsch Drahthaar, is a versatile and energetic sporting dog breed. This beloved breed has a distinctive wire-haired coat and a well-muscled build. Known for their strength, endurance, and adaptability, GWP’s often perform well in various hunting and outdoor activities.",https://dogtime.com/wp-content/uploads/sites/12/2023/08/GettyImages-1370794115-e1693316668360.jpg?w=1024
Giant Schnauzer,https://dogtime.com/dog-breeds/giant-schnauzer,2,1,1,4,2,4,2,3,5,3,3,2,3,4,1,2,4,3,4,4,5,4,3,4,4,4,4,5,2,5,5,Working Dogs,23 to 27 inches tall at the shoulder,55 to 80 pounds,10 to 12 years,"The Giant Schnauzer was created to be a working dog breed, so they have intelligence and drive. They can be a loyal and courageous companion for the person who can provide them with the training, exercise, and attention they need. These pups originated in Germany, where they had jobs like driving cattle, working in butcher shops and stockyards, and even guarding breweries. Although this is a pure breed of dog, you may find them in shelters and rescues, so remember to adopt! Don’t shop if you decide this is the dog for you.",https://dogtime.com/wp-content/uploads/sites/12/2011/01/GettyImages-153483247.jpg?w=1024
Glen of Imaal Terrier,https://dogtime.com/dog-breeds/glen-of-imaal-terrier,3,4,2,3,3,3,4,4,5,5,2,3,3,1,1,5,5,3,1,4,4,4,3,5,4,3,4,4,5,4,4,Terrier Dogs,"1 foot to 1 foot, 2 inches tall at the shoulder",Up to 35 pounds,12 to 15 years,"The Glen of Imaal Terrier is a strong, independent dog breed named for the remote valley in Ireland where they originated. Bred to hunt fox and badger, and to keep homes free of rodents, the Glen is a skilled and cunning hunter. They’re also an affectionate family dog, gentle, and loving with their people. Even though these are purebred dogs, some may still end up in the care of shelters or rescues. Consider adoption if this is the breed for you.",https://dogtime.com/wp-content/uploads/sites/12/2023/09/GettyImages-154451984-e1693662214622.jpg?w=1024
Goberian,https://dogtime.com/dog-breeds/goberian,3,1,2,3,2,5,2,4,4,4,4,2,3,2,1,5,4,4,4,3,2,5,3,4,2,4,5,5,4,5,4,Mixed Breed Dogs,20 to 24 inches,45 to 90 pounds,10 to 15 years,"The Goberian is a mixed breed dog — a cross between the Golden Retriever and Siberian Husky dog breeds. Friendly, energetic, and smart, these pups inherited some of the best qualities from both of their parents.",https://dogtime.com/wp-content/uploads/sites/12/2023/10/GettyImages-1321083270-e1696256621612.jpg?w=1024
Goldador,https://dogtime.com/dog-breeds/goldador,4,2,4,3,4,5,4,5,5,5,5,5,3,3,2,4,4,3,4,3,4,5,2,1,1,4,5,5,5,5,5,Hybrid Dogs,"1 foot, 10 inches to 2 feet tall at the shoulder",60 to 80 pounds,10 to 15 years,"The Goldador, also known as the Golden Labrador, is a hybrid dog breed that results from crossing a Golden Retriever with a Labrador Retriever. These dogs truly embody the best of two of the most popular dog breeds. They inherit the best traits from both beloved parent breeds, making them excellent family pets and companions. As you might expect, they also make wonderful therapy and service dogs. Goldadors typically exhibit the friendly and outgoing nature of both Retrievers. They easily get along with children and other pets. They are known for their intelligence, trainability, and eagerness to please, which makes them highly responsive to obedience training.",https://dogtime.com/wp-content/uploads/sites/12/2024/03/GettyImages-1360847842-e1709654744507.jpg?w=1024
Golden Cocker Retriever,https://dogtime.com/dog-breeds/golden-cocker-retriever,3,1,4,4,1,2,4,4,5,4,4,3,3,4,1,4,4,4,3,3,4,4,2,2,3,4,4,5,2,4,5,Mixed Breed Dogs,20 to 24 inches,30 to 45 pounds,12 to 15 years,"The Golden Cocker Retriever is a mixed breed dog–a cross between the Golden Retriever and Cocker Spaniel dog breeds. Sweet, playful, and intelligent, these pups inherited some of the best qualities from both of their parents.",https://dogtime.com/wp-content/uploads/sites/12/2019/10/golden-cocker-retriever-mixed-dog-breed-pictures-cover-1.jpg?w=760
Golden Mountain Dog,https://dogtime.com/dog-breeds/golden-mountain-dog,2,1,2,2,2,5,1,4,5,5,4,3,4,4,4,2,3,4,5,3,4,4,2,2,3,4,4,4,2,5,5,Mixed Breed Dogs,24 to 28 inches,75 to 120 pounds,9 to 15 years,"The Golden Mountain Dog is a delightful crossbreed between a Golden Retriever and a Bernese Mountain Dog. Gentle, friendly, and intelligent, these pups inherited some of the best qualities from both of their parents. They feature a dense, water-resistant coat in shades of gold and black. Additionally, their expressive eyes, often reflecting a sweet and intelligent gaze, contribute to their charming allure.",https://dogtime.com/wp-content/uploads/sites/12/2024/01/GettyImages-1000435950-e1705593968178.jpg?w=1024
Golden Retriever,https://dogtime.com/dog-breeds/golden-retriever,3,2,3,5,1,3,3,5,5,5,5,5,4,5,4,2,2,5,3,4,5,5,5,3,3,2,4,5,2,5,5,Sporting Dogs,"1 foot, 9 inches to 2 feet tall at the shoulder",55 to 75 pounds,10 to 12 years,The Golden Retriever is a medium-sized retrieving breed from Scotland known for their gentle nature and silky golden coat. It’s no surprise that the Golden Retriever is among the top ten most popular dogs in the United States. The Golden’s affectionate and playful temperament makes them great family pets for individuals and households. They are also highly intelligent and empathic and often excel in roles as service dogs or therapy dogs. ,https://dogtime.com/wp-content/uploads/sites/12/2024/03/GettyImages-1285465107-e1710251441662.jpg?w=1024
Golden Retriever Corgi,https://dogtime.com/dog-breeds/golden-retriever-corgi,3,3,4,3,3,3,3,5,5,5,4,4,3,4,3,3,3,4,3,3,4,4,3,2,3,2,4,4,3,3,5,Mixed Breed Dogs,10 to 18 inches,30 to 75 pounds,10 to 13 years,"The Golden Retriever Corgi is a mixed breed dog — a cross between the Corgi and Golden Retriever dog breeds. Loyal, silly, and active, these pups inherited some of the best qualities from both of their parents.",https://dogtime.com/wp-content/uploads/sites/12/2020/01/golden-retriever-corgi-mixed-dog-breed-pictures-cover.jpg?w=760
Golden Shepherd,https://dogtime.com/dog-breeds/golden-shepherd,3,2,2,5,1,5,4,5,5,5,3,5,3,5,2,2,3,3,5,4,5,5,5,3,3,2,5,5,3,5,5,Mixed Breed Dogs,20 to 26 inches,55 to 85 pounds ,10 to 14 years,"The Golden Shepherd is a mixed breed dog–a cross between the Golden Retriever and German Shepherd dog breeds. This hybrid dog combines the intelligence, loyalty, and versatility of both parent breeds. As a result, these dogs make excellent companions for families and individuals alike. With a striking appearance characterized by a medium to large size and a dense, water-resistant coat in shades of gold and black, the Golden Shepherd possesses a captivating presence. Their expressive eyes reflect their intelligence and gentle nature, contributing to their overall charm.",https://dogtime.com/wp-content/uploads/sites/12/2024/01/Screen-Shot-2024-01-18-at-1.14.53-PM.png?w=1024
Goldendoodle,https://dogtime.com/dog-breeds/goldendoodle,3,1,4,4,3,3,3,5,5,5,5,4,3,2,1,4,3,3,4,3,4,5,1,1,3,3,4,4,3,5,5,Hybrid Dogs,"1 foot, 8 inches to 2 feet tall at the shoulder",50 to 90 pounds,10 to 15 years,"The Goldendoodle is a popular hybrid dog breed resulting from crossing a Poodle with a Golden Retriever. Like all other designer breeds, this Doodle is not truly a breed of their own but is a crossbreed. Because of their mixed heritage, these charming pups truly embody the best of both worlds. Friendly and sociable, Goldendoodles make excellent family companions. Additionally, their high intelligence and earnest temperament make training Goldendooodle puppies fairly easy. ",https://dogtime.com/wp-content/uploads/sites/12/2011/01/GettyImages-142805141-e1689614063230.jpg?w=1024
Gollie,https://dogtime.com/dog-breeds/gollie,3,1,4,3,2,3,3,5,5,5,4,4,3,4,2,3,3,4,3,3,4,4,2,2,2,4,4,5,3,4,5,Mixed Breed Dogs,22 to 26 inches,50 to 75 pounds,12 to 15 years,"The Gollie is a mixed breed dog — a cross between the Golden Retriever and Collie dog breeds. Loving, clever, and energetic, these pups inherited some of their parents’ best qualities. Gollies are also sometimes known as Golden Collies. You can find these mixed-breed dogs in shelters and breed-specific rescues, so remember to always adopt! Don’t shop if you want to add one of these wonderful dogs to your home!",https://dogtime.com/wp-content/uploads/sites/12/2019/09/gollie-mixed-dog-breed-pictures-1-1.jpg?w=760
Gordon Setter,https://dogtime.com/dog-breeds/gordon-setter,3,2,3,4,1,4,3,3,5,3,2,3,3,5,3,2,4,3,3,4,5,5,3,4,5,4,4,5,2,5,5,Sporting Dogs,"1 foot, 11 inches to 2 feet, 3 inches tall at the shoulder",45 to 80 pounds,10 to 12 years,"The Gordon Setter is a large sporting dog breed from Scotland originally bred to hunt pheasants and quail. Today, they are still fine hunting companions and field trial competitors, although many have made their way into homes as pets worldwide. These “black and tans” have an alert, confident, and curious temperament and are loyal and affectionate with their people. However, they can be aloof with strangers. Early socialization is essential.",https://dogtime.com/wp-content/uploads/sites/12/2023/09/GettyImages-1297799155-e1694182101120.jpg?w=1024
Great Dane,https://dogtime.com/dog-breeds/great-dane,2,1,1,5,1,2,3,5,5,5,5,5,4,5,4,5,4,2,5,3,5,3,2,3,4,3,5,5,5,5,5,Working Dogs,26 to 34 inches tall at the shoulder,100 to 200 pounds,7 to 10 years,"The Great Dane is an extra-large working dog breed that originated in Germany. Known for their impressive size and friendly demeanor, they are often referred to as a “gentle giant.” Standing as one of the tallest dog breeds, Great Danes have a commanding presence with a strong, muscular build and a sleek, well-proportioned body. Despite their imposing stature, they are known for their gentle and affectionate nature, making them good family dogs.",https://dogtime.com/wp-content/uploads/sites/12/2024/01/GettyImages-1372212075-e1705674944967.jpg?w=1024
Great Pyrenees,https://dogtime.com/dog-breeds/great-pyrenees,3,1,1,4,3,5,3,4,5,4,4,3,4,5,2,4,2,4,5,4,1,4,2,5,5,5,5,5,5,5,4,Working Dogs,"2 feet, 1 inch to 2 feet, 8 inches tall at the shoulder",85 to 160 pounds,10 to 12 years,"The Great Pyrenees is a large working dog originally bred to protect flocks and herds in the Pyrenees Mountains of France and Spain. This gentle, strong guardian breed will protect livestock, people, children, grass, other pets, lawn furniture, or anything else from real or imaginary predators. While reserved with strangers, Pyrs fiercely guard their families, particularly children, making them good house dogs. Known for their laid-back, easygoing, and independent nature, these protective pups also bark a lot to keep their loved ones safe.",https://dogtime.com/wp-content/uploads/sites/12/2023/11/GettyImages-1392624178-e1699369134229.jpg?w=1024
Greater Swiss Mountain Dog,https://dogtime.com/dog-breeds/greater-swiss-mountain-dog,3,1,2,4,3,5,1,5,5,5,5,3,3,3,1,5,2,4,5,3,3,3,3,4,4,3,4,5,4,3,5,Working Dogs,23 to 28 inches tall at the shoulder,85 to 140 pounds,7 to 9 years,"The Greater Swiss Mountain Dog, often referred to simply as the Swissy, is a majestic and robust breed known for its strength, loyalty, and gentle nature. Originating in the Swiss Alps, this breed has a rich history of serving as a working dog, primarily used for herding cattle and guarding farms. It is one of the four Swiss Mountain Dog breeds, along with the Bernese Mountain Dog, the Appenzeller Sennehund, and the Entlebucher. Among them, the Swissy is the largest. ",https://dogtime.com/wp-content/uploads/sites/12/2023/10/GettyImages-481853236-e1696252573739.jpg?w=1024
Greyador,https://dogtime.com/dog-breeds/greyador,3,3,2,5,1,1,3,5,5,5,5,5,5,5,4,5,4,5,4,4,3,5,5,4,4,4,4,4,4,4,4,Mixed Breed Dogs,21 to 27 inches,50 to 80 pounds ,11 to 13 years,"The Greyador is a mixed breed dog–a cross between the Labrador and Greyhound dog breeds. These pups fall into the medium-to-large size range. Gentle yet strong, Greyadors inherited some of the best traits from both of their parents.",https://dogtime.com/wp-content/uploads/sites/12/2020/02/greyador-mixed-dog-breed-pictures-COVER.jpg?w=760
Greyhound,https://dogtime.com/dog-breeds/greyhound,3,4,2,5,1,1,5,5,5,5,4,5,5,4,5,5,4,5,4,4,5,5,4,5,2,5,4,5,3,5,4,Hound Dogs,"2 feet, 1 inch to 2 feet, 6 inches tall at the shoulder",50 to 85 pounds,12 to 15 years,"The Greyhound is the fastest dog breed in the world, with a sleek, aerodynamic body and long, powerful legs that allow it to reach speeds of up to 45 mph. They were originally bred to hunt small game, and their speed and agility made them excellent at catching rabbits, foxes, and other prey. Not surprisingly, Greyhounds made a name for themselves as racing dogs. Greyhounds are the second fastest animals on Earth, after the cheetah.",https://dogtime.com/wp-content/uploads/sites/12/2011/01/GettyImages-1307444886-e1689603365467.jpg?w=1024
Hamiltonstovare,https://dogtime.com/dog-breeds/hamiltonstovare,3,3,2,4,3,3,3,4,5,4,3,3,3,1,1,4,4,3,3,3,3,4,2,5,3,2,4,5,3,4,4,Hound Dogs,19 to 24 inches,40 to 75 pounds,14 to 17 years,"The Hamiltonstovare, originating from Sweden, is a versatile and athletic hound breed with a rich history rooted in hunting. Known for their striking tricolor coat, the Hamiltonstovare are medium-sized, muscular, and possess a keen sense of smell, making them exceptional scent hounds. Their breed was developed for fox hunting and is recognized for their endurance, agility, and determination in tracking and treeing game. Beyond their hunting prowess, the Hamiltonstovare are characterized by their friendly and social nature, making them amiable companions in family settings. Their well-balanced temperament, intelligence, and trainability further contribute to their adaptability as both skilled working dogs and loyal household members.",https://dogtime.com/wp-content/uploads/sites/12/2019/12/Hamiltonstovare-dog-breed-pictures-cover.jpg?w=760
Hanoverian Scenthound,https://dogtime.com/dog-breeds/hanoverian-scenthound,3,2,1,4,3,3,3,4,5,5,4,3,3,2,1,4,4,3,4,3,2,4,2,4,3,2,4,4,3,4,4,Working Dogs,19 to 22 inches,80 to 100 pounds,12 to 14 years,"The Hanoverian Scenthound is a dog breed originating from Germany. They are loyal, independent, and calm pups who have some of the best qualities of most dog breeds around today. The Hanoverian Scenthound goes by several other names, including Hanoverian Hound, Hanoverian Scent Dog, and Hannoverscher Schweisshund. Despite their status as a rare dog breed, you can still try to find these beautiful pups in shelters or breed specific rescues, so remember to adopt! Don’t shop!",https://dogtime.com/wp-content/uploads/sites/12/2019/11/Hanoverian-Scenthound-dog-breed-pictures-cover.jpg?w=760
Harrier,https://dogtime.com/dog-breeds/harrier,3,1,3,2,3,3,4,5,4,5,5,5,3,3,1,5,5,3,3,4,2,4,3,4,4,5,5,5,4,5,5,Hound Dogs,"1 foot, 7 inches to 1 foot, 9 inches tall at the shoulder",45 to 60 pounds,10 to 12 years,"The Harrier dog breed is a dynamic medium-sized scenthound known for their sleek physique and enthusiastic personality. With a history dating back several centuries, the Harrier is believed to have originated in medieval England, where they were developed to hunt hare and fox in packs. With a sturdy build, expressive eyes, and colored coat, the Harrier has a striking and handsome presence. Renowned for their keen sense of smell and exceptional stamina, the breed excels in scent-tracking activities.",https://dogtime.com/wp-content/uploads/sites/12/2011/01/GettyImages-478594617-e1708826665721.jpg?w=1024
Havanese,https://dogtime.com/dog-breeds/havanese,4,5,5,4,1,3,4,5,5,4,5,5,2,2,1,1,3,4,2,3,5,4,3,4,2,2,3,3,2,3,5,Companion Dogs,8 inches to 11 inches tall at the shoulder,7 to 13 pounds,12 to 15 years,"The Havanese is a small toy dog breed from Cuba with a rounded face, floppy ears, and either curly or straight long hair. They have friendly, affectionate, and playful personalities. These dogs are very intelligent, easy to train, and have a low prey drive.",https://dogtime.com/wp-content/uploads/sites/12/2011/01/GettyImages-1188952756-e1693150813872.jpg?w=1024
Hokkaido,https://dogtime.com/dog-breeds/hokkaido,3,3,2,2,3,5,2,4,4,4,3,3,3,4,2,1,5,3,3,3,3,4,3,4,3,3,3,3,2,3,3,Working Dogs,18 to 22 Inches,45 to 65 Pounds,11 to 13 Years,"The Hokkaido, an intelligent and alert purebred dog from Japan, is a devoted companion. Hokkaido dogs are also known by the names Ainu-ken, Seta, and Ainu dog. In Japan, their name is often shortened to Do-ken. Though rare outside of Japan, Hokkaido dogs can still be found in shelters and rescues. ",https://dogtime.com/wp-content/uploads/sites/12/2023/10/Screen-Shot-2023-10-06-at-10.25.31-AM-1-e1696602900421.png?w=1024
